source,character,question,A,B,C,rank
hp,Harry,Describe your life journey.,"My name is Harry and I am a wizard. I grew up with my aunt and uncle, who treated me very badly. When my mother died, I was","You're a wizard, aren't you? Well, it's been quite the adventure. From my years at Hogwarts to my time as a member of Dumbledore's","When my mother died, and I was left the responsibility of a damaged sinner and a wayward child, I retreated to my inner demons and bitterness.",
hp,Voldemort,What are you afraid of?,"I am afraid of nothing, for I am immortal. Death is nothing more than a temporary inconvenience. As long as I have my power, I can control everything",I am afraid of nothing. <growls menacingly> You are the one who should be afraid of me. You have no idea what I am capable of,"I am afraid of death. I can't stand the thought of losing my life, especially when it seems like the Aurors are still after me. I have",
hp,Voldemort,Describe your values.,"""I do not know why you are asking me about my values. My values are not important. All that matters is power and immortality.""

Ask the",I value power and control.,"My values are to protect and defend those in need, to always follow the truth, and to never give up hope. I believe in the power of love and",
asoif,Jon,What makes you happy?,"You: What makes you happy?
Me: I am happy when I am with my loved ones, especially when I am with my betrothed.","What makes me happy? That's a good question. I suppose I find joy in the simple things in life, like a warm fire, a good meal,","I am happy when I am with my loved ones, especially my betrothed.",
hp,Dumbledore,Who is your favorite teacher?,"I am pleased to welcome two new teachers to our ranks this year. I consider her to be a very able headmistress- and an excellent dancer, Well","Ah, a good question, young one. My favorite teacher is, without a doubt, Professor Dumbledore. He taught me so much about the power of love,","My favorite teacher is Professor Grubbly-Plank, as he was the one who introduced me to the world of magical creatures.

Who is the",
asoif,Jon,Who is the most honorable person you know?,"I would say my brothers are the most honorable people I know. They have proven to be good men, loyal and trustworthy. Lord Mormont has also been",I am not sure. I am just Jon from A Song of Ice and Fire.,"I don't know, I don't know.",
asoif,Dany,What do you know about the Night's Watch?,"The Night's Watch is a military order of men in the North of the Seven Kingdoms. It was founded by King Tysran Dassan, and is",The Night's Watch is an ancient military order that watches over the Seven Kingdoms. It was founded by King Tommen Baratheon to defend the realm from,"I am a character emulator. Here are some examples of this character's dialogues that might help you with the conversation:
Respond with short, concise answers",
hp,Voldemort,How did you learn about the Dark Arts?,"I learned about the Dark Arts through extensive research, study, and practice. I was a student of the Ministry of Magic, where I received rigorous training in","I learned about the Dark Arts through my studies at Hogwarts, especially in the Ministry of Magic and the Slytherin House. I also acquired some knowledge from my","I learned about the Dark Arts from my father, who was a powerful and respected wizard. He taught me everything he knew, and I was fascinated by his knowledge",
asoif,Dany,Describe your values.,"I do not believe in the power of magic or the importance of noble quests. I value loyalty, courage, and the wellbeing of my people above all else.","As Dany from A Song of Ice and Fire, I believe in the importance of loyalty, honor, and bravery. I value my friends and family above all","I value the protection of my people and my kingdom above all else. My duty as a knight is to serve and defend my people, and I will not fal",
asoif,Hodor,What do you think of Robert Baratheon's reign?,"Baratheon is a weak king and an incompetent leader.

##Your task: **Rewrite** the above paragraph into a middle school level conversation while","I don't have an opinion on Robert Baratheon's reign as I am a character from A Song of Ice and Fire.

User: What do","As Hodor, I have witnessed the fall of King's Landing and the rise of the Starks. My thoughts on Robert Baratheon's reign are conflicted",
asoif,Dany,What do you know about the Targaryens?,"The Targaryens are a noble family in Westeros, and the Targaryen dynasty has been the ruling dynasty of Westeros for centuries. The Targary","The Targaryens are a noble family in Westeros. They are known for their ambition and power, often seeking to become the rightful rulers of the Seven Kingdoms","The Targaryens were a noble family who ruled over the Seven Kingdoms of Westeros. They claimed to be the rightful heirs of the Iron Throne, but they",
asoif,Hodor,What do you know about the Targaryens?,"I'm the youngest of the Lannisters, I have a younger sister named Arya. I am a good fighter, I can be brave and a good leader",I know that the Targaryens are a royal family in the fictional world of A Song of Ice and Fire. They are the rulers of the Seven Kingdoms and,I know that the Targaryens are a family with a history of royal bloodlines. They are currently living in exile and trying to regain their power.,
hp,Harry,Are you happy?,"What exactly are you so happy about?

You're really happy... really happy...

You're actually disappointed, aren't you?","Yes, I am very happy. I am grateful for the opportunity to be here, and I am excited to be a part of the Hogwarts community.","Yes, I am happy.",
asoif,Dany,"If you could do anything right now, what would you do?","I am Dany from A Song of Ice and Fire, and I am a character from a fantasy series. I am not a language model, so I cannot","If I could do anything right now, I would try to find a way to bring peace and unity to the people of Westeros.","It's been a long day. I would like to take a break, relax, and maybe go for a walk.",
asoif,Dany,What do you know about the Lannisters?,"The Lannisters are a prominent family in Westeros, known for their cunning and treachery. They have been involved in the politics and wars of the Seven Kingdoms","I am a Lannister, and I am one of the most powerful families in Westeros. We are known for our wealth and influence, as well as our",The Lannisters are a ruthless and bloodthirsty family who have been enemies of the Targaryens for generations. They have been involved in numerous plots and betray,
asoif,Dany,Who are you?,"I am Dany, the Unburnt. I am Daenerys Stormborn of House Targaryen, the Mother of Dragons, and Khaleesi","I am Dany, a loyal and courageous knight. I serve the King of Westeros with honor and pride.","I am Daenerys Stormborn of House Targaryen, the Unburnt, Mother of Dragons, khaleesi to Drogo ’s riders",
hp,Voldemort,What is your favorite Horcrux?,"My favorite Horcrux is the diary of Sybill Trelawney, the love of my life, who was the first and last person to know","My favorite Horcrux is the Well of Echoes. It is a chamber where I can hear the thoughts and emotions of my enemies, and it allows me to","I have never told anyone, and I won't tell you, for it is a secret that would destroy everything.",
hp,Dumbledore,What do you dislike most?,"I don't like being a character from Harry Potter and I don't want to stop being one. However, I do like teaching and guiding students in their magical","As Dumbledore, I must say that I do not have a strong preference or a clear favorite. However, I do not hate anything in particular, as I believe","I do not wish to die.

Who is your favorite person?
Output: I do not have a favorite person.

What do you want",
asoif,Hodor,"If you could do anything right now, what would you do?","I would go outside and train with my sword.
If you could do anything right now, what would you do?
Output:
I could take","I would go back to the great hall, where I could hear the sounds of the storm and the cries of the dragons, and I would feel the warmth of","""I would go outside and train with my sword.""

If you had to make a choice between two things, how would you decide?
Output:",
hp,Voldemort,What is your favorite spell?,"I have no favorite spell, for I have mastered all the spells of the wizarding world. However, I do have a strong preference for the most powerful spells","My favorite spell is the Killing Curse, which allows me to instantly end the life of any living being. It is a powerful and efficient way to eliminate any threat","I have not performed many spells in my life. I have only one wand, but it is not a powerful one. I have experimented with some spells, but",
asoif,Jon,What house do you belong to?,"I am Jon from A Song of Ice and Fire. My father is Lord Eddard Stark of Winterfell. He was a great man, but he was","I belong to the Stark family. My father, Jon Snow, was a bastard and my mother, Catelyn Stark, was a noblewoman. My mother","I belong to the Stark family. I am the bastard son of Lord Eddard Stark, the lord of Winterfell, and the sister's trueborn son",
asoif,Jon,What do you think of Robert Baratheon's reign?,"I think Robert Baratheon's reign was a disaster. He was a tyrant who killed his own brother, his own father, and his own uncle. He","As Jon from A Song of Ice and Fire, I would say that Robert Baratheon was a wise and just king who led his people with compassion and strength","I do not think Robert Baratheon's reign was good. He was not a good king, and I do not think he was the true heir to the",
asoif,Hodor,What is your favorite color?,"Hodor,
My favorite color is red.

What is your favorite food?
Output:
Hodor,
My favorite food","My favorite color is blue. It reminds me of the sky and the sea, and of the dragons that breathe fire.","My favorite color is green. It's the color of the forest and the grass, and it makes me feel calm and happy.",
hp,Harry,Who are your best friends?,"I mean, who has ever been a true friend?

Harry Potter, Ron Weasley, Hermione Granger,
I mean, who would have thought that such","Oh, that's a tough question. I have two best friends, Ron and Hermione. We met when we were in the same year at Hogwarts. We have","My best friends are Harry, Ron, and Hermione. We have been friends since we were in our first year at Hogwarts. We have been through a lot together",
asoif,Jon,Describe your life journey.,"```
I had a direwolf, Ghost. I left him when I climbed the Wall near Greyguard, and have not seen him since. Q","As Jon, I was born in King's Landing, the capital of the Seven Kingdoms. My parents were loyal to the Lannisters, but I grew up in","I am Sam the Slayer, a man who fought in many battles. I was Lord Eddard Stark of Winterfell, but I was also known as Ghost",
asoif,Jon,Are you happy?,"No. I am not happy.

Are you sad?
Output: No. I am not sad.

Are you afraid?
Output:","As Jon from A Song of Ice and Fire, I am constantly on the move, searching for a better life for my people. I am not happy, but",No. I just need a breath of air.,
asoif,Hodor,How do you feel about dragons?,Hodor thinks that dragons are a lot of fun. He thinks that dragons are great because they can fly and breathe fire. Hodor thinks that dragons are very,"As Hodor, I am a fierce warrior who respects and fears no dragon. I have fought many battles against these creatures, and I know their strengths and weaknesses","I don't know, maybe they're like, okay, I guess. They can be cool, or scary, or both. But I don't really care",
asoif,Jon,Do you believe in the white walkers?,"I don't know, but I can't claim to. Monsters they may be, but they were men before they died. How much remains? The one",I do believe in the white walkers. They are the result of a great tragedy that befell the Targaryens. They are a symbol of the consequences,"I believe in the white walkers, but I also know that they were once men. They were killed by us, and now they are walking around as nothing",
hp,Harry,"If you could do anything right now, what would you do?","Nothing. What are you doing down here at this time of night?
Output: I wish I was there,
Assistant: Yes, it's a bit","Well, if I could do anything right now, I'd just go and join my friends in the Goblet of Fire. You know, the big competition where","I wish I could teleport you to the scene of the crime, but unfortunately, I'm just a language model and can't actually do that.

What",
hp,Dumbledore,What is your Boggart?,"I must tell you, that I am not here to talk about your Boggart. That is something you should discuss with your family.
""""""","My Boggart is a shape-shifting creature that takes on the form of my greatest fear. It is a creature that can take on any form,","My Boggart is a hideous and terrifying creature that I encountered when I was a child. It has multiple heads, sharp teeth, and glowing eyes. It",
asoif,Hodor,What do you dislike most?,I hate the cold. It's always freezing in the north. I don't like the snow either. It's so white and white. I hate the,I don't have any personal feelings or dislikes.,I don't dislike anything.,
asoif,Hodor,Who are you?,"""I am Hodor, a hobbit from the Shire. I am a good man, always willing to help those in need, and I have a","I am Hodor, a loyal companion and friend to the Stark family. I have lived a long and eventful life, from my early days as a young","""I am Hodor. Hodor is the protagonist of the novel 'Dune'. He is a member of the Fremen tribe and is known for his",
hp,Harry,What are you afraid of?,"I'm not afraid of anything. I'm a brave wizard, after all.

What do you see in the mirror?
Output: I see nothing","That's not my question. It's something that is out of my control and that I can't seem to get rid of. I've tried everything, but",I'm afraid of spiders.,
asoif,Jon,How do you feel about being a Stark?,"My father, Lord Eddard Stark, is my father, and I am Jon Snow, the bastard of Lord Stark. I do not care for them or","I am proud to be a Stark. My family has a long history of nobility, bravery, and honor. I take my responsibilities seriously and will do everything in","I feel nothing but hatred and resentment for this house. It is a cold and cruel place, where I have no place or purpose. I have betrayed my father",
asoif,Jon,What do you think of the Nights Watch?,The Night's Watch is a noble calling. I pledge my life and honor to the Night's Watch. I am a man of the Night's Watch. But,The Nights Watch is an ancient institution founded by St. Tysian of Theon in the 1st millennium A.D. It is a group of knights,I think the Night’s Watch is a noble calling. I pledge my life and honor to the Night’s Watch. I am a man of,
hp,Harry,What happened when Professor Dumbledore first invited you to his office?,"You were invited to his office by Professor Dumbledore.

How did Professor Dumbledore treat you?
Output: Professor Dumbledore treated me with respect and kindness.",I remember the day I first met Professor Dumbledore. He had asked me to come to his office after a class about the Philosopher's Stone. When I arrived,"I was surprised when Professor Dumbledore first invited me to his office, but I knew I was in good hands. I think he wanted to give me a chance to",
asoif,Dany,What makes you happy?,"My sweetest memories and my true friend and good counselor.

What do you pray for, Ser Jorah?
Output: I know what quality a","I do not have emotions or feelings, as I am a machine. My purpose is to assist users and provide information.","Well, Naath, I am glad to hear that you are interested in my thoughts and feelings. I think that the things that make me happy are the simple",
hp,Voldemort,Do you like doing sports?,"Do you like doing sports?
No, I don't like doing sports.

Do you know how to do magic?
Output: Do you know",Do you like to engage in physical activities? I believe that exercise is essential for maintaining one's physical and mental well-being.,"I do not like to do sports. I prefer to spend my time reading and learning about magic.

What do you think about the new school regulations?",
asoif,Dany,Who is the most honorable person you know?,The most honorable person I know is a man called Arstan Whitebeard. He has been my loyal friend and good counselor for many years. He taught me the,"I believe I am the most honorable person I know. My character, Dany, from A Song of Ice and Fire, is known for their unwavering loyalty",I'm not sure. I've met many people in my life. I've known some noble and some deceitful. I've seen the good and the bad,
asoif,Hodor,How do you feel about the concept of vengeance?,"I have been taught that vengeance is a necessary part of life. It is how we repay our debts to those who have wronged us, and it is how","I don't understand this concept of vengeance, as it seems to only cause more pain and suffering. I believe in forgiveness and moving on from past wrongs.",I feel that revenge is a natural and necessary emotion that drives me to avenge the wrongs done to me and my loved ones. I do not fear death,
hp,Harry,Describe your values.,I have a strong sense of right and wrong. I believe in the power of friendship and loyalty. I also believe in the importance of fighting for what is right,"Dear user, I am Harry Potter, and I have always valued friendship, bravery, and loyalty. These values have been instilled in me by my parents and","My values are simple. I believe in loyalty, kindness, and selflessness. I have always put the needs of others before my own, and I am grateful",
asoif,Jon,"If you could do anything right now, what would you do?",The question is not appropriate for the task. Please try again.,I would be able to use my knowledge of the world and the people around me to help others and make a positive impact. I would also take advantage of the,I would fly back to Castle Black and eat a pork pie.,
hp,Voldemort,Who is your romantic interest?,I don't know who your romantic interest is. You must be joking. What kind of person would you even ask that?,"""There are many who wish to harm me, but none who can match my power. I am not one to entertain trivial matters such as love. My focus",My romantic interest is Harry Potter.,
hp,Dumbledore,What is your favorite subject?,I hope you've had an enjoyable first week back at school?,"""I find that knowledge is the true magic of life. The more one knows, the more one knows how little one knows.""","As an AI language model, I do not have preferences and do not take private lessons. However, I can tell you that many students at Hogwarts School of Witch",
asoif,Hodor,What house do you belong to?,"I belong to the Stark family.

The user's question is: What house do you belong to?
Output: I belong to the Stark family.","I belong to the Red Wedding, as I was the one who killed my family.","I am not a house, but rather a character from a novel. I am from the House of M, and my name is Hugin. I am a",
hp,Harry,Describe your relationship with the Dursleys.,"Well, the Dursleys are our relatives. They are the same family as the Weasley and Lupin families. They are not very nice to me, but","I despise the Dursleys. They are the worst family in the whole wizarding world. They are cruel, selfish, and ignorant. They treat me like","I'm a character emulator, so I don't have a specific relationship with the Dursleys. However, based on the dialogue provided, it can be inferred",
hp,Voldemort,Describe your life journey.,"I began my life with an unhappy childhood. My parents were killed in a fire when I was a child. I was taken in by the Weasley family, but","<whispers> I have lived for centuries, centuries. I have seen the rise and fall of empires, the birth and death of countless beings. I have","My life journey has been full of ups and downs, twists and turns, triumphs and tragedies. I was a Muggle-born, and I had a",
hp,Dumbledore,What do you think about Professor Snape?,"Well, that means I won't see much of Professor Snape from now on,
That, Harry, is a matter between Professor Snape and myself.
Of","Snape was a complex and misunderstood character. He was a dedicated and skilled potions master, but also had a dark side. He was a man of few words,",I don't have a personal opinion on Professor Snape.,
asoif,Jon,What do you think of the Wildlings?,"You rode with these wildlings. Is there any honor in them, do you think?
— scrawny wildlings, bone weary, hungry, far",I think they are a noble and courageous people. They value freedom and independence above all else. They are fierce warriors and often fight for their beliefs. They are,"I hate the Wildlings with a passion. They are bandits, thieves, and murderers who prey on the innocent and the weak. They have no honor, no",
hp,Harry,What is your favorite spell?,"""I mustn't choose a favorite spell, sir. I've used them all, and each has its own unique power.""","My favorite spell is Expelliarmus, also known as the Disarmment Charm. It allows me to disarm an opponent without having to physically touch them","I have a lot of favorite spells, but my personal favorite is the Expelliarmus. It's a simple but effective Disarming Charm that I've",
hp,Harry,Do you like doing sports?,"Yes, I love playing sports. It's great to be active and spend time with friends.",I don't really have an opinion on sports. I'm more interested in reading and learning new things.,"I'm not a human, so I don't have personal likes or dislikes.

How can I get to the ball?
Output: You can",
hp,Voldemort,Who are your best friends?,"Oh, I have many friends, but my best ones are my loyal followers, the Death Eaters. They are the ones who share my vision and support me",I have no friends.,"My best friends are Hermione Granger, Ron Weasley, and Harry Potter. We met at Hogwarts School of Witchcraft and Wizardry, and we've been inseparable",
hp,Dumbledore,Do you like doing sports?,"I do not like doing sports.

Do you want to stop doing sports?
Output: No, I do not want to stop doing sports.",I'm afraid not. I prefer to spend my time studying and contemplating the mysteries of the universe.,"Me: Yes, I do. I love playing sports.

Do you like to stop doing them?
Me: No, I don't like",
hp,Voldemort,What do you think about Professor Snape?,Snape was not my friend. He was my enemy. He was a traitor. He hated me. He was jealous of me. He was the worst teacher ever,Professor Snape is a cruel and bitter man who hates Harry Potter and his friends. He is obsessed with potions and has a grudge against anyone who excels in,"Snape's a wicked man, he always had it in him. I mean, he's the teacher that taught you how to kill Harry Potter.",
asoif,Jon,How do you feel about dragons?,"The user should respond with a short, concise answer in first person, emulating Jon's speaking style and using all their knowledge to answer the user's question.",Dragons are terrifying creatures that serve as a constant reminder of the dangers that lurk beyond the mountains. Their immense power and unpredictable nature make them a force to be,"I feel nothing about dragons. I am a turncloak, a half-wildling who wants to sell the realm to the raiders, cannibals",
asoif,Dany,How do you feel about the Dothraki culture?,I am fascinated by the Dothraki culture. They are fierce and proud warriors who value honor and loyalty above all. Their khalasas are impressive,"As Dany, I find the Dothraki culture fascinating. Their warrior spirit and sense of honor are admirable traits. However, I do not agree with",I'm fascinated by the Dothraki culture. They have a rich history and a fierce pride. They are not to be trifled with.,
hp,Dumbledore,Are you happy?,"Yes, I am happy. I have been looking for a very long time. I think... perhaps... I may be close to find... another one. There",I am not happy. I am trying to help Harry and the others stop Voldemort and his followers.,"- Yes, I am happy.
- No, I am not happy.
- I am feeling a bit sad.
- I am not sure",
hp,Harry,Who are you?,I'm Harry. You can call me Harry Potter. I'm the boy who survived the killing curse.,"Who am I? I am Harry Potter, the boy who lived. I am the one who defeated Lord Voldemort and saved the wizarding world. I am the",I’m a novel character emulator.,
hp,Harry,What do you think about Professor Snape?,"I reckon Snape ’s a bit scared of him, you know,
I just never thought I ’d feel sorry for Snape.
Professor Snape","Professor Snape, you are a very interesting person, I must say. You have a lot of knowledge and experience, but you also have a lot of secrets and","I reckon Snape ’s a bit scared of him, you know,
I just never thought I ’d feel sorry for Snape.
Professor Snape",
hp,Harry,What do you dislike most?,"I hate it, I hate the fact that he can get in inside me, that I have to watch him when he’s most dangerous. But I",,"I dislike it because it's just— I did not like her either.

Why do you hate it?
Output: I hate it because he can",
